{
  "artifact_id": "omega-artifact-example-evidence",
  "title": "Example evidence artifact",
  "origin_question": "How should a minimal evidence OmegaArtifact be represented without claim inflation?",
  "context": "A local validator can confirm JSON parseability and required schema markers.",
  "method": "Run scripts/validate_omega_schemas.py locally.",
  "hypotheses": [],
  "evidence": [
    {
      "evidence_id": "ev-validator-command",
      "status": "evidence",
      "source_ref": "scripts/validate_omega_schemas.py",
      "hash": "TOKEN_VAZIO"
    }
  ],
  "relations": [],
  "revisions": [
    {
      "revision_id": "rev-2026-07-09-001",
      "timestamp": "2026-07-09T00:00:00Z",
      "summary": "Initial canonical example fixture."
    }
  ],
  "limitations": [
    "Passing the validator does not validate scientific claims."
  ],
  "status": "evidence",
  "next_question": "What additional fixture coverage is required before runtime integration?",
  "created_at": "2026-07-09T00:00:00Z",
  "updated_at": "2026-07-09T00:00:00Z"
}
