{
  "artifact_id": "omega-artifact-example-metaphor",
  "title": "Example metaphor artifact",
  "origin_question": "How should a minimal metaphor OmegaArtifact be represented without claim inflation?",
  "context": "River flow is used as a didactic metaphor for evolving relations.",
  "method": "Explicit metaphor marker; no physical equivalence is claimed.",
  "hypotheses": [],
  "evidence": [],
  "relations": [],
  "revisions": [
    {
      "revision_id": "rev-2026-07-09-001",
      "timestamp": "2026-07-09T00:00:00Z",
      "summary": "Initial canonical example fixture."
    }
  ],
  "limitations": [
    "Metaphor is not evidence and must not be promoted to fact."
  ],
  "status": "metaphor",
  "next_question": "What additional fixture coverage is required before runtime integration?",
  "created_at": "2026-07-09T00:00:00Z",
  "updated_at": "2026-07-09T00:00:00Z"
}
